{
  "$schema": "https://json-schema.org/draft/2020-12/schema",
  "title": "OmniCodex EvidencePack",
  "type": "object",
  "additionalProperties": false,
  "required": [
    "schema_version",
    "status",
    "task_kind",
    "snapshot",
    "summary",
    "relevant_files",
    "findings",
    "risks",
    "unknowns",
    "validation"
  ],
  "properties": {
    "schema_version": {
      "const": 1
    },
    "status": {
      "enum": [
        "completed",
        "blocked",
        "needs_review"
      ]
    },
    "task_kind": {
      "enum": [
        "repo_scout",
        "bulk_file_read",
        "log_distill",
        "diff_analysis",
        "long_doc_digest"
      ]
    },
    "snapshot": {
      "type": "string",
      "minLength": 1,
      "maxLength": 512
    },
    "summary": {
      "type": "string",
      "minLength": 1,
      "maxLength": 4000
    },
    "relevant_files": {
      "type": "array",
      "maxItems": 128,
      "uniqueItems": true,
      "items": {
        "type": "string",
        "minLength": 1,
        "maxLength": 4096
      }
    },
    "findings": {
      "type": "array",
      "maxItems": 64,
      "items": {
        "type": "object",
        "additionalProperties": false,
        "required": [
          "claim",
          "evidence"
        ],
        "properties": {
          "claim": {
            "type": "string",
            "minLength": 1,
            "maxLength": 2000
          },
          "evidence": {
            "type": "array",
            "minItems": 1,
            "maxItems": 8,
            "items": {
              "type": "object",
              "additionalProperties": false,
              "required": [
                "path",
                "start_line",
                "end_line",
                "kind"
              ],
              "properties": {
                "path": {
                  "type": "string",
                  "minLength": 1,
                  "maxLength": 4096
                },
                "start_line": {
                  "type": "integer",
                  "minimum": 1
                },
                "end_line": {
                  "type": "integer",
                  "minimum": 1
                },
                "kind": {
                  "enum": [
                    "source",
                    "log",
                    "diff",
                    "doc"
                  ]
                }
              }
            }
          }
        }
      }
    },
    "risks": {
      "type": "array",
      "maxItems": 32,
      "items": {
        "type": "string",
        "minLength": 1,
        "maxLength": 1500
      }
    },
    "unknowns": {
      "type": "array",
      "maxItems": 32,
      "items": {
        "type": "string",
        "minLength": 1,
        "maxLength": 1500
      }
    },
    "validation": {
      "type": "array",
      "maxItems": 32,
      "items": {
        "type": "object",
        "additionalProperties": false,
        "required": [
          "check",
          "status",
          "reference"
        ],
        "properties": {
          "check": {
            "type": "string",
            "minLength": 1,
            "maxLength": 1000
          },
          "status": {
            "enum": [
              "passed",
              "failed",
              "not_run"
            ]
          },
          "reference": {
            "type": "string",
            "maxLength": 2000
          }
        }
      }
    }
  }
}
